{
  "SalesOrder": "example_value",
  "SalesOrderItem": "example_value",
  "PricingProcedureStep": "example_value",
  "PricingProcedureCounter": "example_value",
  "ConditionType": "example_value",
  "ConditionRateValue": "example_value",
  "ConditionCurrency": "example_value",
  "ConditionQuantity": "example_value",
  "ConditionQuantityUnit": "example_value",
  "ConditionAmount": "example_value",
  "TransactionCurrency": "example_value",
  "ConditionCategory": "example_value",
  "ConditionIsForStatistics": true,
  "ConditionOrigin": "example_value",
  "IsGroupCondition": "example_value",
  "ConditionControl": "example_value",
  "ConditionInactiveReason": "example_value",
  "ConditionClass": "example_value",
  "ConditionIsManuallyChanged": true
}